{
  "aggregationPolicy": "Report each Model×Harness cell across the three blocked task families; preserve task-level rows. Do not count repeated reads, verifier assertions, or Provider turns as independent replicates.",
  "computationMode": "deterministic",
  "construct": "Number of Harness Tool calls used to complete or stop the run.",
  "evidenceMinimum": "deterministic-observation",
  "kind": "ordivon.experimental-metric-spec",
  "knownLimitations": [
    "Pilot has three deterministic task blocks and one live run per Model×Harness×task cell; cell effects are descriptive and do not establish broad model or Harness superiority.",
    "Reported unit: calls."
  ],
  "metricClass": "behavior",
  "metricId": "metric:tool-calls",
  "missingDataPolicy": "exclude-with-reason",
  "nonClaims": [
    "Metric does not establish Provider, Runtime, Harness, Git, or domain authority.",
    "This small pilot does not license a general model ranking."
  ],
  "ownerInputs": [
    {
      "digest": "sha256:f4943c87ff68c90728762e5cd01d630da0e2371fbfbb34ee9537fe54ad387449",
      "objectId": "services/harness/scripts/run_adaptive_edit_r2_live_ab.py",
      "objectKind": "file",
      "ownerId": "harness"
    }
  ],
  "replicationUnit": "live-harness-run",
  "schemaVersion": 1,
  "specDigest": "sha256:42a1bc07a999e38a6c490fe6c288e12adbdb8ae3ce528442f0d676264e754bfd",
  "unitOfAnalysis": "live-harness-run",
  "valueShape": "scalar"
}
